ASD Cup, Atalanta vs. Bologna (Wed Mar 25)


                             Atalanta  |  Bologna
                              3-5-2 A  |  4-3-3 N
                                  Fle  |  Jo
                                       |
                         P_Gollini GK  |  GK L_Skorupski
                         M_Caldara DF  |  DF Danilo
                      Rafael_Toloi DF  |  DF S_Denswil
                        J_Palomino DF  |  DF M_Dijks
                        H_Hateboer MF  |  DF T_Tomiyasu
                          R_Gosens MF  |  MF G_Medel
                         R_Freuler MF  |  MF R_Orsolini
                     R_Malinovskyi MF  |  MF L_Krejci
                           A_Gomez MF  |  FW N_Sansone
                          J_Ilicic FW  |  FW R_Palacio
                          D_Zapata FW  |  FW F_Santander
                                       |
                      M_Sportiello SUB |  SUB Da_Costa
                        B_Djimsiti SUB |  SUB I_Mbaye
                         M_de_Roon SUB |  SUB J_Schouten
                         M_Pasalic SUB |  SUB N_Dominguez
                          L_Muriel SUB |  SUB M_Barrow




Min. 5  :(ata) J_Ilicic è troppo veloce per la difesa 
          ...  J_Ilicic drives the ball low ! 
          ...  L_Skorupski won't get to that! 
          ...  GOAL !! 
          ...  Superb finish!!! 
          ...  Atalanta go in front now with that goal! 
          ...  Atalanta 1-0 Bologna ...
Min. 6  :(bol) Bologna changed their strategy to play A 
Min. 7  :(ata) J_Ilicic sidesteps G_Medel 
          ...  He showed great skill there 
          ...  J_Ilicic has time and space! 
          ...  He tries the lob! 
          ...  GOAL !! 
          ...  L_Skorupski got his hand to it, but couldn't keep it out 
          ...  Atalanta 2-0 Bologna ...
Min. 8  :(ata) The Atalanta manager shouts at them from the touchline to play P 
Min. 8  :(ata) H_Hateboer moves into a DF role on the manager's orders 
Min. 9  :(bol) L_Krejci retreats under pressure 
          ...  He hoofs the ball up field 
          ...  N_Sansone gets on the end of it 
          ...  N_Sansone has time and space! 
          ...  He shoots towards goal! 
          ...  Its sails over! 
          ...  He has squandered a golden opportunity 
Min. 10 :(ata) Curled in dangerously from A_Gomez to R_Gosens 
          ...  Danilo reads it well 
          ...  This boy is a quality defender 
          ...  The crowd sing his praises 
Min. 12 :(bol) G_Medel with the mazy run 
          ...  But J_Palomino clears the ball to safety 
Min. 13 :(ata) A_Gomez with the dribble 
          ...  Danilo is easily beaten 
          ...  A_Gomez looks to see where L_Skorupski is! 
          ...  He rifles in the shot! 
          ...  It hits off a defender! 
          ...  L_Skorupski is wrong footed! 
          ...  It drifts just wide! 
          ...  CORNER! 
          ...  A_Gomez crosses it in! 
          ...  Rafael_Toloi gets on the end of it 
          ...  L_Skorupski watches it sail safely wide! 
Min. 15 :(ata) D_Zapata with the dribble 
          ...  He skips through the tackle from S_Denswil 
          ...  D_Zapata lobs L_Skorupski! 
          ...  But L_Skorupski parries the shot 
          ...  The defender manages to scramble the ball away 
Min. 21 :(bol) F_Santander watches his team-mates pull the defenders out of position 
          ...  He decides to be greedy and run into the space 
          ...  He's gone right through! 
          ...  H_Hateboer with a deliberate foul 
          ...  There's no place in the game for that kind of challenge 
          ...  He got away with just a warning 
Min. 23 :(bol) F_Santander with the first time pass to R_Orsolini 
          ...  M_Caldara wins the ball with a clear tackle 
Min. 24 :(bol) R_Palacio with the header on 
          ...  He finds S_Denswil in space 
          ...  But he loses control of it 
          ...  M_Caldara takes possession 
Min. 32 :(ata) A_Gomez with the mazy dribble 
          ...  He takes it past Danilo 
          ...  Danilo moves quickly to get the tackle in this time 
Min. 32 :(bol) R_Palacio steps over the ball 
          ...  He nutmegs J_Palomino 
          ...  That a lovely piece of trickery 
          ...  J_Palomino recovers to win the ball back 
Min. 38 :(bol) L_Krejci finds N_Sansone with a perfectly weighted pass 
          ...  N_Sansone tries to lob the keeper ! 
          ...  P_Gollini parries it 
          ...  The defender clears it 
Min. 39 :(ata) H_Hateboer with a measured ball to J_Ilicic 
          ...  J_Ilicic sends it flying towards goal! 
          ...  L_Skorupski with the save 
          ...  He holds onto it as well! 
Min. 40 :(ata) J_Palomino has the ball on the wing 
          ...  He knocks the ball past G_Medel! 
          ...  He has some space now! 
          ...  J_Palomino with the deft touch! 
          ...  He hits the ball towards goal! 
          ...  L_Skorupski guesses right 
Min. 42 :(ata) R_Freuler looks around for some movement 
          ...  He sees a man in space! 
          ...  He hits the ball up to H_Hateboer 
          ...  H_Hateboer attempts the shot! 
          ...  But L_Skorupski punches it away 
Min. 43 :(REF) The 4th referee signals that there are 3 minutes of time to be added on
Min. 44 :(ata) R_Freuler crosses into the box, finding R_Gosens 
          ...  G_Medel reads it well 
          ...  This boy is a quality defender 
          ...  The crowd sing his praises 
Min. 47 :(ata) R_Malinovskyi takes control of the loose ball 
          ...  He plays the ball across to R_Gosens 
          ...  R_Gosens with a low drive through the rain! 
          ...  The shot slips through L_Skorupski's hands 
          ...  But goes wide! 
          ...  He got away with that! 
          ...  Goal kick given! That looked like a corner to me 
Min. 47 :(ata) J_Ilicic trova lo spazio intelligentemente 
          ...  G_Medel with a reckless challenge 
          ...  The Referee called him over for a strong verbal warning 
          ...  FREE KICK 
          ...  R_Gosens floats it forward 
          ...  J_Ilicic latches onto the end of it 
          ...  S_Denswil with a superb tackle! 
          ...  He easily dispossessed him. 
Min. 48 :(bol) G_Medel gets to the by line and finds N_Sansone with a beautiful cross 
          ...  N_Sansone tries the shot ! 
          ...  But P_Gollini punches it away 
          ...  He took a knock there 
          ...  His manager is looking on anxiously 
          ...  He's ok to carry on 

*************  HALF TIME  ****************
Risultato Fine Primo Tempo: Atalanta 2-0 Bologna

Min. 47 :(bol) R_Palacio fa un uno-due intelligente con il suo compagno di squadra 
          ...  Si dirige verso la porta 
          ...  But he steps on the ball and falls over! 
          ...  H_Hateboer hits it out for a throw 
Min. 49 :(ata) J_Ilicic runs at the defender 
          ...  He takes it past him 
          ...  J_Ilicic fires off a left-footed shot ! 
          ...  L_Skorupski gets a hand to it!! 
          ...  But he slots in the rebound 
          ...  GOAL !! 
          ...  He has completed his hat trick!! 
          ...  The defenders have been run ragged! 
          ...  Atalanta 3-0 Bologna ...
Min. 50 :(ata) A_Gomez curls the ball out wide to J_Ilicic 
          ...  S_Denswil gets to the ball first 
Min. 53 :(ata) J_Ilicic looks to play the ball out wide 
          ...  He plays the ball across to D_Zapata 
          ...  D_Zapata with the side footed shot! 
          ...  L_Skorupski guesses right 
Min. 53 :(bol) R_Orsolini has it now 
          ...  He takes on M_Caldara 
          ...  He gets past him! 
          ...  He puts in L_Krejci! 
          ...  L_Krejci tries to beat P_Gollini from outside the area! 
          ...  P_Gollini makes a great save 
          ...  But he can't hold onto it! 
          ...  He gathers it at the second attempt! 
Min. 54 :(ata) R_Malinovskyi has found himself in space 
          ...  He looks up for his team mates 
          ...  He swings the ball in 
          ...  J_Ilicic gets on the end of the pass 
          ...  He is in space! 
          ...  S_Denswil wins the ball 
Min. 61 :(ata) D_Zapata with a neat pass into J_Ilicic 
          ...  J_Ilicic tries to lob the keeper ! 
          ...  It floats over L_Skorupski 
          ...  Its heading goal ward! 
          ...  But floats just over 
          ...  That was a great effort 
Min. 62 :(ata) A_Gomez plays it to his team mate for a one-two 
          ...  J_Ilicic decides to go for goal instead! 
          ...  J_Ilicic chases it through, he must score ! 
          ...  It hits the bar and goes over 
          ...  Well, sometimes they go in, sometimes they don't 
Min. 64 :(ata) R_Freuler with a precise pass to J_Ilicic 
          ...  G_Medel robs him of the ball 
Min. 65 :(bol) It looks like the manager is going to make a few changes to his side. 
          ...  N_Dominguez will come on for G_Medel and play MF 
Min. 65 :(bol) M_Barrow is being brought on 
          ...  F_Santander is leaving the pitch 
          ...  He looks disappointed that he won't be continuing 
          ...  Looks like his replacement will play FW 
Min. 65 :(bol) L_Krejci looks for options 
          ...  He sees a man in space! 
          ...  He hits the ball up to N_Sansone 
          ...  Brilliantly taken away by R_Freuler !! 
          ...  Any youngsters out there should be taking notes 
Min. 68 :(ata) Rafael_Toloi looks up for support for support 
          ...  He spots his team mate making a run now 
          ...  He plays it across to his team mate and runs forward now! 
          ...  J_Ilicic receives the pass and heads towards the goal 
          ...  J_Ilicic launches himself head first to connect with the low cross! 
          ...  L_Skorupski blocks the shot with his legs 
          ...  It goes clear! 
Min. 69 :(ata) D_Zapata pushes it past M_Dijks 
          ...  D_Zapata with the punt towards goal! 
          ...  But he puts it wide 
          ...  That was a terrible attempt! 
Min. 70 :(ata) M_de_Roon is being brought on 
          ...  A_Gomez is leaving the pitch 
          ...  Looks like the substitute will play MF 
Min. 72 :(ata) D_Zapata knocks it past S_Denswil and runs onto it 
          ...  He showed great skill and pace there 
          ...  A cracking drive from D_Zapata ! 
          ...  L_Skorupski is beaten! 
          ...  It hits the bar!! 
          ...  GOAL !! 
          ...  Superb finish! 
          ...  Atalanta 4-0 Bologna ...
Min. 72 :(bol) R_Orsolini with a precise pass to N_Dominguez 
          ...  M_de_Roon fouls badly 
          ...  I don't think he meant anything other than trying to get the ball 
          ...  YELLOW CARD!! 
          ...  He'll be off if he does that again 
Min. 74 :(ata) R_Gosens controls the ball with a deft piece of skill 
          ...  He plays the ball out to the right! 
          ...  J_Ilicic gets onto the end of the pass! 
          ...  J_Ilicic fires the shot in! 
          ...  It goes wide! 
          ...  He made that look harder than it was!! 
Min. 75 :(ata) L_Muriel is being prepared to come on 
          ...  D_Zapata is leaving the pitch 
          ...  He looks disappointed that he won't be continuing 
          ...  Looks like his replacement will play FW 
Min. 78 :(ata) L_Muriel runs at the defence 
          ...  He nutmegs the defender 
          ...  He showed his class there 
          ...  T_Tomiyasu reads the play well 
Min. 81 :(ata) R_Freuler si fa strada 
          ...  Grande sforzo 
          ...  R_Freuler curls it towards the top corner ! 
          ...  OOOOHHHHH!!!! 
          ...  Unbelievable!!! 
          ...  It's gone wide 
Min. 81 :(bol) R_Orsolini wins possession 
          ...  He plays the ball across to M_Barrow 
          ...  M_Caldara steals the ball of off him 
Min. 83 :(ata) R_Malinovskyi plays a first time ball through the defence to J_Ilicic 
          ...  J_Ilicic with a screamer of a shot ! 
          ...  It's beaten L_Skorupski 
          ...  It goes wide !! 
Min. 86 :(ata) L_Muriel off the woodwork. 
          ...  R_Gosens picks up the deflection 
          ...  Danilo gathers up the loose ball 
Min. 88 :(REF) The 4th referee signals that there are 3 minutes of time to be added on
Min. 88 :(ata) R_Malinovskyi kills the ball dead 
          ...  He sees a team mate leave his marker! 
          ...  He plays the ball across to him! 
          ...  M_de_Roon gets on the end of the pass 
          ...  M_de_Roon with the attempt at goal! 
          ...  L_Skorupski can't get to it! 
          ...  OH! It has gone just over the bar! 
          ...  L_Skorupski makes a cocky smile 
          ...  Did he know that was going over? 
Min. 89 :(bol) N_Sansone takes advantage of a bad back pass 
          ...  J_Ilicic stands firm and knocks the player to the ground!! 
          ...  That’s a rash challenge!! 
          ...  YELLOW CARD!! 
          ...  He was lucky to escape with a caution! 
          ...  FREE KICK! 
          ...  It is in a good position! 
          ...  N_Sansone drives it under the wall 
          ...  But P_Gollini punches it away 
          ...  He had to be brave to come for that one 
Min. 89 :(bol) N_Dominguez ottiene il possesso nella sua metà 
          ...  A well-placed shot from N_Dominguez ! 
          ...  P_Gollini with the diving save 
          ...  He must have spotted the TV cameras! 

*************  FULL TIME  ****************



Dettagli della Partita
-------------------------------------------------------------------------------------------
Stadio               : Gewiss Stadium
-------------------------------------------------------------------------------------------
Atalanta Match Info
-------------------------------------------------------------------------------------------
Miglior Giocatore    : J_Ilicic (Man of the Match)
Marcatori            : J_Ilicic (5,7,49), D_Zapata (72)
Espulsi              : N/A
Ammoniti             : M_de_Roon (72), J_Ilicic (89)
Infortunati          : N/A
-------------------------------------------------------------------------------------------
Bologna Match Info
-------------------------------------------------------------------------------------------
Miglior Giocatore    : L_Krejci
Marcatori            : N/A
Espulsi              : N/A
Ammoniti             : N/A
Infortunati          : N/A
-------------------------------------------------------------------------------------------

Statistiche della Partita
-------------------------------------------------------------------------------------------
                                Atalanta  |    Bologna
Occasioni da Goal    :          20        |       6
Fuori                :          10        |       1
In porta             :          10        |       5
Possesso             :          62        |       38
Calci d'Angolo       :           1        |       0
Cartellini Rossi     :           0        |       0
Cartellini Gialli    :           2        |       0
Sostituzioni Usate   :           2        |       2
Falli                :           5        |       5
Key Tackles          :           7        |       9
Passaggi Chiave      :          16        |       9
-------------------------------------------------------------------------------------------
Risultato Finale     : Atalanta 4 - 0 Bologna
-------------------------------------------------------------------------------------------


Player Statistics - Atalanta
Name          Pos  St  Tk  Ps  Sh  Ag | Min Sav Ktk Kps Ass Sht Gls Yel Red KAb TAb PAb SAb
-------------------------------------------------------------------------------------------
P_Gollini      GK  22   1   1   1   1 |  96   5   0   0   0   0   0   0   0  66   0   0   0
M_Caldara      DF   1  25   2   1  18 |  96   0   3   0   0   0   0   0   0   0  47   8   8
Rafael_Toloi   DF   1  24   5   2  19 |  96   0   0   1   0   1   0   0   0   0   0  10   1
J_Palomino     DF   1  23   5   1  19 |  96   0   2   0   0   1   0   0   0   0  26   0   3
H_Hateboer     DF   1  11  18   7  17 |  96   0   1   1   0   1   0   0   0   0  24  10   3
R_Gosens       MF   1  10  20   8  19 |  96   0   0   1   0   1   0   0   0   0   8  18   9
R_Freuler      MF   1   9  21   9  12 |  96   0   1   3   0   1   0   0   0   0  13  30   1
R_Malinovskyi  MF   1   8  25  11  19 |  96   0   0   4   0   0   0   0   0   0   0  40   0
A_Gomez        MF   1   1  25  12   8 |  73   0   0   3   0   1   0   0   0   0   0  30   1
J_Ilicic       FW   1   1  13  26   9 |  96   0   0   1   0   9   3   1   0   0  -3   7  76
D_Zapata       FW   1   1   6  25  16 |  78   0   0   1   0   4   1   0   0   0   0  10  30
M_Sportiello   GK  22   1   1   1   1 |   0   0   0   0   0   0   0   0   0   0   0   0   0
B_Djimsiti     DF   1  22   6   1  19 |   0   0   0   0   0   0   0   0   0   0   0   0   0
M_de_Roon      MF   1  12  19   8  21 |  23   0   0   0   0   1   0   1   0   0  -3  -3  -2
M_Pasalic      MF   1   8  21   9  18 |   0   0   0   0   0   0   0   0   0   0   0   0   0
L_Muriel       FW   1   1   8  22   5 |  18   0   0   1   0   0   0   0   0   0   0  10   0

Player Statistics - Bologna
Name          Pos  St  Tk  Ps  Sh  Ag | Min Sav Ktk Kps Ass Sht Gls Yel Red KAb TAb PAb SAb
-------------------------------------------------------------------------------------------
L_Skorupski    GK  22   1   1   1   5 |  96   6   0   0   0   0   0   0   0  38   0   0   0
Danilo         DF   1  24   3   1  19 |  96   0   3   0   0   0   0   0   0   0  39   0   0
S_Denswil      DF   1  21   8   5  18 |  96   0   3   0   0   0   0   0   0   0  39   0   0
M_Dijks        DF   1  19   8   1  19 |  96   0   0   0   0   0   0   0   0   0   0   0   0
T_Tomiyasu     DF   1  19   7   1  17 |  96   0   1   0   0   0   0   0   0   0  13   0   0
G_Medel        MF   1  11  15   2  24 |  68   0   2   1   0   0   0   0   0   0  26  10   0
R_Orsolini     MF   1   1  20   9   2 |  96   0   0   3   0   0   0   0   0   0   0  30   0
L_Krejci       MF   1   5  21   8  14 |  96   0   0   3   0   1   0   0   0   0   0  30   3
N_Sansone      FW   1   1  10  22  11 |  96   0   0   0   0   4   0   0   0   0   0   0  10
R_Palacio      FW   1   2  10  19  19 |  96   0   0   1   0   0   0   0   0   0   0  10   0
F_Santander    FW   1   1   7  20  18 |  68   0   0   1   0   0   0   0   0   0   0  10   0
Da_Costa       GK  19   1   1   1   3 |   0   0   0   0   0   0   0   0   0   0   0   0   0
I_Mbaye        DF   1  19   7   3  18 |   0   0   0   0   0   0   0   0   0   0   0   0   0
J_Schouten     MF   1   9  15   5  11 |   0   0   0   0   0   0   0   0   0   0   0   0   0
N_Dominguez    MF   1   9  19   8  24 |  28   0   0   0   0   1   0   0   0   0   0   0   3
M_Barrow       FW   1   1   2  16   1 |  28   0   0   0   0   0   0   0   0   0   0   0   0
1585170363 Produced from ESMS+ V3.35